pmid,has_online_dataset,pmid_found_in_dbs,ochsner_found_any_data,ochsner_found_geo_data,ochsner_found_arrayexpress_data,ochsner_found_smd_data,ochsner_data_ids,pubmed_is_humans,pubmed_is_animals,pubmed_is_mice,pubmed_is_fungi,pubmed_is_bacteria,pubmed_is_plants,pubmed_is_viruses,pubmed_is_cultured_cells,pubmed_is_cancer,pubmed_date_published,approx_date_published,pubmed_authors,pubmed_journal,pubmed_number_times_cited_in_pmc,impact_factor,discipline_journal,accession,in_centralized_db,data_available,pmids_from_links,pmids_from_links_in_ochsner_set,centralized_link_to_ochsner_pmid,if_no_link_then_what,dataset_in_ochsner,pmid_from_ochsner,pmid_from_links_or_ochsner,release_date,submission_date,submitter,contributors,species,number_samples,array_design,in_arrayexpress,in_geo,ochsner_journal,ochsner_other,journal_policy_requires17389372,1,1,1,0,0,1,SMD-Experiment-Set-No_3978,0,1,1,0,1,0,0,1,0,2007 Apr 3,4/1/07,"Weiss DS, Brotcke A, Henry T, Margolis JJ, Chan K, Monack DM",Proc Natl Acad Sci U S A,12,9.598,0,E-SMDB-3978,1,1,['17389372'],['17389372'],1,,FALSE,,17389372,5/1/07,None,David Weiss,David Weiss,Francisella tularensis,26,A-SMDB-1115:  SMD Francisella tularensis  Array CPH,1,0,0,0,117400755,1,1,1,0,1,0,E-MEXP-558,0,1,1,0,0,0,0,0,0,2007 Apr 10,4/1/07,"Regnault B, Cayet N, Caille D, Demuth K, Hardelin JP, Janel N, Meda P, Petit C",Proc Natl Acad Sci U S A,3,9.598,0,E-MEXP-558,1,1,['17400755'],['17400755'],1,,TRUE,['17400755'],17400755,2/14/06,None,Beatrice Regnault,Beatrice Regnault,Mus musculus,6,A-AFFY-36: Affymetrix GeneChip  Mouse Genome 430A 2.0 [Mouse430A_2],1,0,0,0,117170127,1,1,1,0,1,0,E-TABM-133,1,0,0,0,0,0,0,1,0,2007 Apr 15,4/1/07,"Raslova H, Kauffmann A, Ripoche H, Larbret F, Robert T, Le Roux DT, Kroemer G, Debili N, Dessen P, Lazar V, Vainchenker W",Blood,2,10.896,1,E-TABM-133,1,1,['17170127'],['17170127'],1,,TRUE,['17170127'],17170127,8/22/06,None,Philippe Dessen,Philippe Dessen,Homo sapiens,4,A-AGIL-11: Agilent Whole Human Genome Oligo Microarray 012391 G4112A,1,0,0,0,117434133,1,1,1,0,1,0,E-TABM-220,0,0,0,1,0,0,0,0,0,2007 Apr 13,4/1/07,"Lackner DH, Beilharz TH, Marguerat S, Mata J, Watt S, Schubert F, Preiss T",Mol Cell,5,13.156,0,E-TABM-217,1,1,['17434133'],['17434133'],1,,FALSE,,17434133,3/16/07,None,Daniel Lackner,Daniel Lackner,Schizosaccharomyces pombe,2,A-MEXP-585: Sanger Institute S. pombe array 3.1.1 template 6.3,1,0,0,0,117434133,1,1,1,0,1,0,E-TABM-220,0,0,0,1,0,0,0,0,0,2007 Apr 13,4/1/07,"Lackner DH, Beilharz TH, Marguerat S, Mata J, Watt S, Schubert F, Preiss T",Mol Cell,5,13.156,0,E-TABM-218,1,1,['17434133'],['17434133'],1,,FALSE,,17434133,3/20/07,None,Daniel Lackner,Daniel Lackner,Schizosaccharomyces pombe,3,A-MEXP-584: Sanger Institute S. pombe array 3.1.1 template 6.2,1,0,0,0,117434133,1,1,1,0,1,0,E-TABM-220,0,0,0,1,0,0,0,0,0,2007 Apr 13,4/1/07,"Lackner DH, Beilharz TH, Marguerat S, Mata J, Watt S, Schubert F, Preiss T",Mol Cell,5,13.156,0,E-TABM-219,1,1,['17434133'],['17434133'],1,,FALSE,,17434133,3/16/07,None,Daniel Lackner,Daniel Lackner,Schizosaccharomyces pombe,2,A-MEXP-531: Sanger Institute S. pombe array 3.1.1 template 5.7,1,0,0,0,117434133,1,1,1,0,1,0,E-TABM-220,0,0,0,1,0,0,0,0,0,2007 Apr 13,4/1/07,"Lackner DH, Beilharz TH, Marguerat S, Mata J, Watt S, Schubert F, Preiss T",Mol Cell,5,13.156,0,E-TABM-220,1,1,['17434133'],['17434133'],1,,TRUE,['17434133'],17434133,3/19/07,None,Daniel Lackner,Daniel Lackner,Schizosaccharomyces pombe,2,A-AFFY-47: Affymetrix GeneChip  Yeast Genome 2.0 Array [Yeast_2],1,0,0,0,117434133,1,1,1,0,1,0,E-TABM-220,0,0,0,1,0,0,0,0,0,2007 Apr 13,4/1/07,"Lackner DH, Beilharz TH, Marguerat S, Mata J, Watt S, Schubert F, Preiss T",Mol Cell,5,13.156,0,E-TABM-222,1,1,['17434133'],['17434133'],1,,FALSE,,17434133,3/6/07,None,Daniel Lackner,Daniel Lackner,Schizosaccharomyces pombe,4,A-MEXP-585: Sanger Institute S. pombe array 3.1.1 template 6.3,1,0,0,0,117293870,1,1,1,0,1,0,E-MEXP-982,1,1,1,0,0,0,0,1,0,2007 Apr,4/1/07,"Ludwiczek S, Theurl I, Muckenthaler MU, Jakab M, Mair SM, Theurl M, Kiss J, Paulmichl M, Hentze MW, Ritter M, Weiss G",Nat Med,1,26.382,1,E-MEXP-982,1,1,['17293870'],['17293870'],1,,TRUE,['17293870'],17293870,2/5/07,None,martina muckenthaler,martina muckenthaler,Mus musculus,6,A-MEXP-649: EMBL Mus musculus IronChip 0.5k v7,1,0,0,0,117409432,1,0,1,0,0,0,http://www.crukdmf.icr.ac.uk/array/21/21.html,1,0,0,0,0,0,0,1,1,2007 Apr 1,4/1/07,"Maloney A, Clarke PA, Stein R, Koopman JO, Akpan A, Yang A, Zvelebil M, Cramer R, Stimson L, Aherne W, Banerji U, Judson I, Sharp S, Powers M, deBilly E, Salmons J, Walton M, Burlingame A, Waterfield M, Workman P",Cancer Res,3,7.672,1,,0,1,,,0,,,,,,,,,Homo sapiens,,Other,0,0,0,1,117371979,1,1,1,1,0,0,GSE5355,0,1,1,0,0,0,0,0,0,2007 Apr 1,4/1/07,"Denning TL, Granger SW, Mucida D, Graddy R, Leclercq G, Zhang W, Honey K, Rasmussen JP, Cheroutre H, Rudensky AY, Kronenberg M",J Immunol,1,6.068,1,GSE5355,1,1,[u'17371979'],[u'17371979'],1,,TRUE,['17371979'],17371979,3-Apr-07,19-Jul-06,Steve  W. Granger,Denning TL,Mus musculus,6,GPL81: [MG_U74Av2] Affymetrix Murine Genome U74 Version 2 Array,1,1,0,0,117242199,1,1,1,1,0,0,GSE5510,0,1,1,0,0,0,0,0,0,2007 Apr,4/1/07,"Cheng Y, Buffone MG, Kouadio M, Goodheart M, Page DC, Gerton GL, Davidson I, Wang PJ",Mol Cell Biol,2,6.42,1,GSE5510,1,1,[u'17242199'],[u'17242199'],1,,TRUE,['17242199'],17242199,9-Aug-07,11-Aug-06,Jeremy Wang,Cheng Y,Mus musculus,4,GPL1261: [Mouse430_2] Affymetrix Mouse Genome 430 2.0 Array,1,1,0,0,117404290,1,1,1,1,0,0,GSE5678,1,0,0,0,0,0,0,0,1,2007 Apr 15,4/1/07,"Fernald GH, Knott S, Pachner A, Caillier SJ, Narayan K, Oksenberg JR, Mousavi P, Baranzini SE",J Immunol,0,6.068,1,GSE5678,1,1,[u'17404290'],[u'17404290'],1,,TRUE,['17404290'],17404290,18-Apr-07,31-Aug-06,Sergio Baranzini,Fernald GH,Homo sapiens,130,GPL4228: UCSF Gladstone Genomics Core Human 21k Oligo array (2003),0,1,0,0,117283056,1,1,1,1,0,0,GSE5872,0,1,0,0,0,0,0,0,0,2007 Apr,4/1/07,"Gabut M, Dejardin J, Tazi J, Soret J",Mol Cell Biol,1,6.42,1,GSE5872,1,1,[u'17283056'],[u'17283056'],1,,TRUE,['17283056'],17283056,1-Feb-07,19-Sep-06,johann Soret,None,Drosophila melanogaster,12,GPL4275: MLRG_Droso_15K_V1.1,0,1,0,0,117264171,1,1,1,1,0,0,GSE6011,1,1,1,0,0,0,0,0,1,2007 Apr,4/1/07,"Pescatori M, Broccolini A, Minetti C, Bertini E, Bruno C, Bernardini C, Mirabella M, Silvestri G, Giglio V, Modoni A, Pedemonte M, Tasca G, Galluzzi G, Mercuri E, Tonali PA, Ricci E",FASEB J,1,6.791,0,GSE6011,1,1,[u'17264171'],[u'17264171'],1,,TRUE,['17264171'],17264171,25-Dec-06,10-Oct-06,Mario Pescatori,Pescatori M,Homo sapiens,37,GPL96: [HG-U133A] Affymetrix Human Genome U133A Array,1,1,0,0,017426146,1,0,1,1,0,0,GSE6412,1,1,1,0,0,0,0,0,0,2007 Apr 17,4/1/07,"Li X, Wang XJ, Tannenhauser J, Podell S, Mukherjee P, Hertel M, Biane J, Masuda S, Nottebohm F, Gaasterland T",Proc Natl Acad Sci U S A,3,9.598,0,GSE6412,1,1,,,0,no_citation,TRUE,['17426146'],17426146,6-Dec-06,1-Dec-06,XiaoChing Li,Li X,Serinus canaria,24,GPL4526: Zebra finch brain cDNA microarray (v1),0,1,0,0,117389363,1,1,1,1,0,0,GSE6578,0,1,1,0,0,0,0,0,0,2007 Apr 3,4/1/07,"Lunzer MM, Yekkirala A, Hebbel RP, Portoghese PS",Proc Natl Acad Sci U S A,0,9.598,0,GSE6578,1,1,[u'17389363'],[u'17389363'],1,,TRUE,['17389363'],17389363,14-Mar-07,20-Dec-06,Ajay Yekkirala,Yekkirala A,Mus musculus,6,GPL4464: UMN Mouse 11K V 11_22_04 BMAP,0,1,0,0,117405863,1,1,1,1,0,0,"GSE6697,GSE6698",0,1,1,0,0,0,0,1,0,2007 Apr 10,4/1/07,"Kenzelmann M, Maertens S, Hergenhahn M, Kueffer S, Li L, Wang S, Ittrich C, Lemberger T, Arribas R, Jonnakuty S, Hollstein MC, Schmid W, Gretz N",Proc Natl Acad Sci U S A,2,9.598,0,GSE6697,1,1,[u'17405863'],[u'17405863'],1,,TRUE,['17405863'],17405863,16-Jan-07,10-Jan-07,Marc Kenzelmann,Kenzelmann M,Mus musculus,23,GPL81: [MG_U74Av2] Affymetrix Murine Genome U74 Version 2 Array,1,1,0,0,117405863,1,1,1,1,0,0,"GSE6697,GSE6698",0,1,1,0,0,0,0,1,0,2007 Apr 10,4/1/07,"Kenzelmann M, Maertens S, Hergenhahn M, Kueffer S, Li L, Wang S, Ittrich C, Lemberger T, Arribas R, Jonnakuty S, Hollstein MC, Schmid W, Gretz N",Proc Natl Acad Sci U S A,2,9.598,0,GSE6698,1,1,[u'17405863'],[u'17405863'],1,,TRUE,['17405863'],17405863,16-Jan-07,10-Jan-07,Marc Kenzelmann,Kenzelmann M,Mus musculus,10,GPL339: [MOE430A] Affymetrix Mouse Expression 430A Array,1,1,0,0,117351622,1,1,1,1,0,0,GSE6807,1,1,0,0,0,0,0,0,0,2007 Apr,4/1/07,"Kittler R, Surendranath V, Heninger AK, Slabicki M, Theis M, Putz G, Franke K, Caldarelli A, Grabner H, Kozak K, Wagner J, Rees E, Korn B, Frenzel C, Sachse C, Guo J, Schelter J, Burchard J, Linsley PS, Jackson AL, Habermann B, Buchholz F",Nat Methods,4,15.478,0,GSE6807,1,1,[u'17351622'],[u'17351622'],1,,TRUE,['17351622'],17351622,10-Apr-07,19-Jan-07,Aimee Jackson,Kittler R,Homo sapiens,80,GPL3991: Human 3.0 A1,0,1,0,0,117404298,1,1,1,0,0,1,SMD-Experiment-Set-No_3827,1,1,0,0,0,0,0,0,0,2007 Apr 15,4/1/07,"Kim SK, Fouts AE, Boothroyd JC",J Immunol,5,6.068,1,GSE8521,1,1,[u'17404298'],[u'17404298'],1,,FALSE,,17404298,19-Jul-07,18-Jul-07,None,Kim S,Homo sapiens,16,GPL5620: SHGS,0,1,0,1,117185464,1,1,1,1,0,0,GSE9782,1,0,0,0,0,0,0,0,1,2007 Apr 15,4/1/07,"Mulligan G, Mitsiades C, Bryant B, Zhan F, Chng WJ, Roels S, Koenig E, Fergus A, Huang Y, Richardson P, Trepicchio WL, Broyl A, Sonneveld P, Shaughnessy JD Jr, Bergsagel PL, Schenkein D, Esseltine DL, Boral A, Anderson KC",Blood,2,10.896,1,GSE9782,1,1,[u'17185464'],[u'17185464'],1,,TRUE,['17185464'],17185464,6-Dec-07,4-Dec-07,George  Mulligan,Bryant B,Homo sapiens,528,GPL96: [HG-U133A] Affymetrix Human Genome U133A Array,1,1,0,0,117400805,0,,0,0,0,0,,0,1,0,0,0,0,0,0,0,2007 Apr,4/1/07,"Nilsson O, Parker EA, Hegde A, Chau M, Barnes KM, Baron J",J Endocrinol,0,2.636,1,,0,0,,,0,,,,,,,,,,,,0,0,0,0,017234707,0,,0,0,0,0,,1,1,1,0,0,0,0,1,1,2007 Apr,4/1/07,"Mitsutake N, Iwao A, Nagai K, Namba H, Ohtsuru A, Saenko V, Yamashita S",Endocrinology,5,5.045,1,,0,0,,,0,,,,,,,,,,,,0,0,0,0,017234708,0,,0,0,0,0,,0,1,0,0,0,0,0,1,0,2007 Apr,4/1/07,,Endocrinology,1,5.045,1,,0,0,,,0,,,,,,,,,,,,0,0,0,0,017244764,0,,0,0,0,0,,0,1,1,0,0,0,0,0,0,2007 Apr,4/1/07,"Eacker SM, Shima JE, Connolly CM, Sharma M, Holdcraft RW, Griswold MD, Braun RE",Mol Endocrinol,1,5.337,1,,0,0,,,0,,,,,,,,,,,,0,0,0,0,017372002,0,,0,0,0,0,,1,1,1,0,1,0,0,1,1,2007 Apr 1,4/1/07,"Butchar JP, Rajaram MV, Ganesan LP, Parsa KV, Clay CD, Schlesinger LS, Tridandapani S",J Immunol,2,6.068,1,,0,0,,,0,,,,,,,,,,,,0,0,0,0,117372017,0,,0,0,0,0,,1,0,0,0,0,0,0,0,1,2007 Apr 1,4/1/07,"Youssef LA, Schuyler M, Gilmartin L, Pickett G, Bard JD, Tarleton CA, Archibeque T, Qualls C, Wilson BS, Oliver JM",J Immunol,2,6.068,1,,0,0,,,0,,,,,,,,,,,,0,0,0,0,117372020,0,,0,0,0,0,,1,0,0,0,0,0,0,1,1,2007 Apr 1,4/1/07,"Boniface K, Diveu C, Morel F, Pedretti N, Froger J, Ravon E, Garcia M, Venereau E, Preisser L, Guignouard E, Guillet G, Dagregorio G, Moles JP, Yssel H, Chevalier S, Bernard FX, Gascan H, Lecron JC",J Immunol,4,6.068,1,,0,0,,,0,,,,,,,,,,,,0,0,0,0,117404297,0,,0,0,0,0,,1,1,0,0,0,0,0,0,1,2007 Apr 15,4/1/07,"Pedemonte N, Caci E, Sondo E, Caputo A, Rhoden K, Pfeffer U, Di Candia M, Bandettini R, Ravazzolo R, Galietta LJ",J Immunol,1,6.068,1,,0,0,,,0,,,,,,,,,,,,0,0,0,0,117261596,0,,0,0,0,0,,0,0,0,1,0,0,0,0,1,2007 Apr,4/1/07,"Matsuo T, Otsubo Y, Urano J, Tamanoi F, Yamamoto M",Mol Cell Biol,6,6.42,1,,0,0,,,0,,,,,,,,,,,,0,0,0,0,117234717,0,,0,0,0,0,,1,1,0,0,0,0,0,0,0,2007 Apr,4/1/07,"Rodrigues AJ, Coppola G, Santos C, Costa Mdo C, Ailion M, Sequeiros J, Geschwind DH, Maciel P",FASEB J,1,6.791,0,,0,0,,,0,,,,,,,,,,,,0,0,0,0,017409425,0,,0,0,0,0,,1,0,0,0,0,0,0,1,1,2007 Apr 1,4/1/07,"Kumar SM, Yu H, Edwards R, Chen L, Kazianis S, Brafford P, Acs G, Herlyn M, Xu X",Cancer Res,3,7.672,1,,0,0,,,0,,,,,,,,,,,,0,0,0,0,117409444,0,,0,0,0,0,,1,0,0,0,0,0,0,1,1,2007 Apr 1,4/1/07,"Cui H, Darmanin S, Natsuisaka M, Kondo T, Asaka M, Shindoh M, Higashino F, Hamuro J, Okada F, Kobayashi M, Nakagawa K, Koide H, Kobayashi M",Cancer Res,0,7.672,1,,0,0,,,0,,,,,,,,,,,,0,0,0,0,117409456,0,,0,0,0,0,,1,0,0,0,0,0,0,0,1,2007 Apr 1,4/1/07,"Alonso SR, Tracey L, Ortiz P, Palacios J, Linares J, Serrano S, Pajares R, Artiga MJ, Piris MA",Cancer Res,5,7.672,1,,0,0,,,0,,,,,,,,,,,,0,0,0,0,117440055,0,,0,0,0,0,,0,1,1,0,0,0,0,0,1,2007 Apr 15,4/1/07,"Wang W, Wyckoff JB, Goswami S, Wang Y, Sidani M, Segall JE, Condeelis JS",Cancer Res,4,7.672,1,,0,0,,,0,,,,,,,,,,,,0,0,0,0,117440082,0,,0,0,0,0,,0,1,1,0,0,0,0,0,1,2007 Apr 15,4/1/07,"Wang Y, Thakur A, Sun Y, Wu J, Biliran H, Bollig A, Liao DJ",Cancer Res,0,7.672,1,,0,0,,,0,,,,,,,,,,,,0,0,0,0,117440099,0,,0,0,0,0,,1,1,1,0,0,0,0,1,1,2007 Apr 15,4/1/07,"Tsai MH, Cook JA, Chandramouli GV, DeGraff W, Yan H, Zhao S, Coleman CN, Mitchell JB, Chuang EY",Cancer Res,2,7.672,1,,0,0,,,0,,,,,,,,,,,,0,0,0,0,117440110,0,,0,0,0,0,,1,0,0,0,0,0,0,1,1,2007 Apr 15,4/1/07,"Miki Y, Suzuki T, Tazawa C, Yamaguchi Y, Kitada K, Honma S, Moriya T, Hirakawa H, Evans DB, Hayashi S, Ohuchi N, Sasano H",Cancer Res,2,7.672,1,,0,0,,,0,,,,,,,,,,,,0,0,0,0,117389401,0,,0,0,0,0,,1,1,1,0,0,0,0,1,1,2007 Apr 3,4/1/07,"Bhatt AS, Welm A, Farady CJ, Wilson K, Craik CS",Proc Natl Acad Sci U S A,1,9.598,0,,0,0,,,0,,,,,,,,,,,,0,0,0,0,117428923,0,,0,0,0,0,,1,1,0,0,0,0,0,1,0,2007 Apr 17,4/1/07,"Carter PH, Liu RQ, Foster WR, Tamasi JA, Tebben AJ, Favata M, Staal A, Cvijic ME, French MH, Dell V, Apanovitch D, Lei M, Zhao Q, Cunningham M, Decicco CP, Trzaskos JM, Feyen JH",Proc Natl Acad Sci U S A,0,9.598,0,,0,0,,,0,,,,,,,,,,,,0,0,0,0,117138826,0,,0,0,0,0,,1,0,0,0,0,0,0,0,1,2007 Apr 1,4/1/07,"Aksoy E, Albarani V, Nguyen M, Laes JF, Ruelle JL, De Wit D, Willems F, Goldman M, Goriely S",Blood,1,10.896,1,,0,0,,,0,,,,,,,,,,,,0,0,0,0,117148583,0,,0,0,0,0,,1,0,0,0,0,0,0,1,1,2007 Apr 1,4/1/07,"Nagel S, Burek C, Venturini L, Scherr M, Quentmeier H, Meyer C, Rosenwald A, Drexler HG, MacLeod RA",Blood,0,10.896,1,,0,0,,,0,,,,,,,,,,,,0,0,0,0,117192395,0,,0,0,0,0,,1,0,0,0,0,0,0,0,0,2007 Apr 15,4/1/07,"Macaulay IC, Tijssen MR, Gusnanto A, Steward M, Burns P, Langford CF, Ellis PD, Dudbridge F, Zwaginga JJ, Watkins NA, van der Schoot CE, Ouwehand WH",Blood,5,10.896,1,,0,0,,,0,,,,,,,,,,,,0,0,0,0,117483452,1,1,1,0,1,0,E-TABM-130,1,1,1,0,0,0,0,0,1,2007 May 15,5/1/07,"Chalmel F, Rolland AD, Chung SS, Demougin P, Gattiker A, Moore J, Patard JJ, Wolgemuth DJ, Primig M",Proc Natl Acad Sci U S A,7,9.598,0,E-TABM-130,1,1,['17483452'],['17483452'],1,,TRUE,['17483452'],17483452,10/13/06,None,Alexandre Gattiker,Alexandre Gattiker,Rattus norvegicus,35,A-AFFY-43: Affymetrix GeneChip  Rat Genome 230 2.0 [Rat230_2],1,0,0,0,117483315,1,0,1,0,1,0,E-MEXP-561,1,0,0,0,0,0,1,0,1,2007 May 1,5/1/07,"Vart RJ, Nikitenko LL, Lagos D, Trotter MW, Cannon M, Bourboulia D, Gratrix F, Takeuchi Y, Boshoff C",Cancer Res,1,7.672,1,E-MEXP-561,1,1,['17047149'],,0,PMID_to_another_paper_same_authors,TRUE,['17483315'],17483315,2/18/06,None,Stephen Henderson,Stephen Henderson,Homo sapiens,22,A-AFFY-44: Affymetrix GeneChip  Human Genome U133 Plus 2.0 [HG-U133_Plus_2],1,0,0,0,117303664,1,0,1,1,0,0,GSE487,0,1,0,0,0,0,0,0,0,2007 May,5/1/07,"Almon RR, DuBois DC, Jusko WJ",Endocrinology,2,5.045,1,GSE487,1,1,[u'12808002'],,0,PMID_to_prev_paper_by_same_authors,TRUE,['17303664'],17303664,16-Jul-03,1-Jul-03,Eric Hoffman,Almon R ,Rattus norvegicus,91,GPL85: [RG_U34A] Affymetrix Rat Genome U34 Array,0,1,0,0,017452630,1,1,1,1,0,0,GSE5325,1,0,0,0,0,0,0,0,1,2007 May 1,5/1/07,"Saal LH, Johansson P, Holm K, She QB, Maurer M, Koujak S, Ferrando AA, Memeo L, Isola J, Bendahl PO, Rosen N, Hibshoosh H, Borg A, Parsons R",Proc Natl Acad Sci U S A,13,9.598,0,GSE5325,1,1,[u'17452630'],[u'17452630'],1,,TRUE,['17452630'],17452630,7-Apr-07,17-Jul-06,Lao H Saal,Saal LH,Homo sapiens,105,GPL3883: Swegene Human 27K RAP UniGene188 array,0,1,0,0,117502615,1,1,1,1,0,0,GSE6747,0,0,0,0,0,0,0,0,0,2007 May 22,5/1/07,"Hendrickson EL, Haydock AK, Moore BC, Whitman WB, Leigh JA",Proc Natl Acad Sci U S A,4,9.598,0,GSE6747,1,1,[u'17502615'],[u'17502615'],1,,TRUE,['17502615'],17502615,1-Apr-07,15-Jan-07,John Leigh,Hendrickson E,Methanococcus maripaludis,68,GPL2509: Methanococcus maripaludis PCR-array,0,1,0,0,117337443,1,1,1,1,0,0,GSE6789,0,1,1,0,0,0,0,1,0,2007 May 4,5/1/07,"Joyce C, Kinzel B, Tschopp C, Mathison JC, Davis CN, Gram H",J Biol Chem,3,5.581,1,GSE6789,1,1,[u'17337443'],[u'17337443'],1,,TRUE,['17337443'],17337443,30-Mar-07,18-Jan-07,Anton Gl??ck,Koziczak-Holbro M,Mus musculus,12,GPL1261: [Mouse430_2] Affymetrix Mouse Genome 430 2.0 Array,1,1,0,0,117510386,1,1,1,1,0,0,GSE6791,1,0,0,0,0,0,1,0,1,2007 May 15,5/1/07,"Pyeon D, Newton MA, Lambert PF, den Boon JA, Sengupta S, Marsit CJ, Woodworth CD, Connor JP, Haugen TH, Smith EM, Kelsey KT, Turek LP, Ahlquist P",Cancer Res,1,7.672,1,GSE6791,1,1,[u'17510386'],[u'17510386'],1,,TRUE,['17510386'],17510386,15-May-07,18-Jan-07,Paul Ahlquist,Pyeon D,Homo sapiens,84,GPL570: [HG-U133_Plus_2] Affymetrix Human Genome U133 Plus 2.0 Array,1,1,0,0,117363378,1,0,1,1,0,0,GSE6820,1,0,0,0,0,0,0,0,1,2007 May 18,5/1/07,"Fitsialos G, Chassot AA, Turchi L, Dayem MA, LeBrigand K, Moreilhon C, Meneguzzi G, Mari B, Barbry P, Ponzio G",J Biol Chem,3,5.581,1,GSE6820,1,1,,,0,no_citation,TRUE,['17363378'],17363378,30-Dec-07,22-Jan-07,GEORGIOS FITSIALOS,Fitsialos G,Homo sapiens,36,GPL1521: cDNA microarray quad 5000,0,1,0,0,117483324,1,1,1,1,0,0,GSE7132,1,0,0,0,0,0,0,1,1,2007 May 1,5/1/07,"Hellebrekers DM, Melotte V, Langenkamp E, Molema G, Fuks F, Herman JG, Van Criekinge W, Griffioen AW, van Engeland M",Cancer Res,2,7.672,1,GSE7132,1,1,[u'17483324'],[u'17483324'],1,,TRUE,['17483324'],17483324,28-Feb-07,26-Feb-07,Debby Hellebrekers,Hellebrekers DM,Homo sapiens,4,GPL885: Agilent-011521 Human 1A Microarray G4110A (Feature Number version),1,1,0,0,117517597,1,1,1,1,0,0,GSE7163,1,0,0,0,1,0,0,0,0,2007 May 29,5/1/07,"Li M, Lai Y, Villaruz AE, Cha DJ, Sturdevant DE, Otto M",Proc Natl Acad Sci U S A,7,9.598,0,GSE7163,1,1,[u'17517597'],[u'17517597'],1,,TRUE,['17517597'],17517597,26-Feb-08,28-Feb-07,Dan Sturdevant,Li M,Coxiella burnetii,30,GPL4692: Affymetrix RML Custom Pathogenic chip 3,0,1,0,0,117379603,1,1,1,1,0,0,GSE7473,1,0,0,0,0,0,0,0,1,2007 May 11,5/1/07,"Rebouissou S, Imbeaud S, Balabaud C, Boulanger V, Auffray C",J Biol Chem,0,5.581,1,GSE7473,1,1,[u'17379603'],[u'17379603'],1,,TRUE,['17379603'],17379603,1-May-07,6-Apr-07,Sandrine Imbeaud,Rebouissou S,Homo sapiens,41,GPL3282: &nbsp;,0,1,0,0,117510436,1,0,1,1,0,0,GSE8466,1,0,0,0,0,0,0,0,1,2007 May 15,5/1/07,"Mostaghel EA, Page ST, Lin DW, Fazli L, Coleman IM, True LD, Knudsen B, Hess DL, Nelson CC, Matsumoto AM, Bremner WJ, Gleave ME, Nelson PS",Cancer Res,6,7.672,1,GSE8466,1,1,,,0,no_citation,TRUE,['17510436'],17510436,25-Oct-07,13-Jul-07,Denise Mauldin,Mostaghel EA,Homo sapiens,12,GPL4766: FHCRC Human Prostate PEDB cDNA Array v8,0,1,0,0,117442931,1,1,1,0,0,1,SMD-Experiment-Set-No_4035,0,1,1,0,0,0,0,0,0,2007 May 1,5/1/07,"Zhou M, McPherson L, Feng D, Song A, Dong C, Lyu SC, Zhou L, Shi X, Ahn YT, Wang D, Clayberger C, Krensky AM",J Immunol,0,6.068,1,GSE8497,1,1,[u'17442931'],[u'17442931'],1,,FALSE,,17442931,17-Jul-07,16-Jul-07,None,Zhou M,Mus musculus,3,GPL5574: mob,1,1,0,1,117510434,1,1,1,0,0,0,http://cancerres.aacrjournals.org/cgi/content/full/67/10/5017/DC1,1,0,0,0,0,0,0,1,1,2007 May 15,5/1/07,"Lin Z, Reierstad S, Huang CC, Bulun SE",Cancer Res,3,7.672,1,GSE11506,1,1,[u'17510434'],[u'17510434'],1,,FALSE,,17510434,20-May-08,20-May-08,Zhihong Lin,Lin Z,Homo sapiens,9,GPL570: [HG-U133_Plus_2] Affymetrix Human Genome U133 Plus 2.0 Array,1,1,1,0,117299135,0,,0,0,0,0,,0,1,1,0,0,0,0,1,0,2007 May,5/1/07,"Lawson MA, Tsutsumi R, Zhang H, Talukdar I, Butler BK, Santos SJ, Mellon PL, Webster NJ",Mol Endocrinol,1,5.337,1,,0,0,,,0,,,,,,,,,,,,0,0,0,0,017374609,0,,0,0,0,0,,0,1,1,0,0,0,0,1,0,2007 May 11,5/1/07,"Lagergren A, Zetterblad J, Smith E, Basta B, Bryder D, Akerblad P, Sigvardsson M",J Biol Chem,1,5.581,1,,0,0,,,0,,,,,,,,,,,,0,0,0,0,117409384,0,,0,0,0,0,,1,0,0,0,0,0,0,1,1,2007 May 25,5/1/07,"Scoumanne A, Chen X",J Biol Chem,2,5.581,1,,0,0,,,0,,,,,,,,,,,,0,0,0,0,117475832,0,,0,0,0,0,,0,1,1,0,0,0,0,0,1,2007 May 15,5/1/07,"Hurchla MA, Sedy JR, Murphy KM",J Immunol,2,6.068,1,,0,0,,,0,,,,,,,,,,,,0,0,0,0,117475848,0,,0,0,0,0,,1,0,0,0,0,0,0,1,1,2007 May 15,5/1/07,"Severa M, Remoli ME, Giacomini E, Annibali V, Gafa V, Lande R, Tomai M, Salvetti M, Coccia EM",J Immunol,0,6.068,1,,0,0,,,0,,,,,,,,,,,,0,0,0,0,117475886,0,,0,0,0,0,,1,1,1,0,0,0,0,1,1,2007 May 15,5/1/07,"Ripoll VM, Irvine KM, Ravasi T, Sweet MJ, Hume DA",J Immunol,3,6.068,1,,0,0,,,0,,,,,,,,,,,,0,0,0,0,117264169,0,,0,0,0,0,,0,1,0,0,0,0,0,0,1,2007 May,5/1/07,"Mellott TJ, Follettie MT, Diesl V, Hill AA, Blusztajn JK",FASEB J,1,6.791,0,,0,0,,,0,,,,,,,,,,,,0,0,0,0,017456585,0,,0,0,0,0,,1,0,0,0,0,0,0,1,1,2007 May 1,5/1/07,"Wu G, Guo Z, Chang X, Kim MS, Nagpal JK, Liu J, Maki JM, Kivirikko KI, Ethier SP, Trink B, Sidransky D",Cancer Res,1,7.672,1,,0,0,,,0,,,,,,,,,,,,0,0,0,0,117510389,0,,0,0,0,0,,1,0,0,0,0,0,0,1,1,2007 May 15,5/1/07,"Lam DC, Girard L, Ramirez R, Chau WS, Suen WS, Sheridan S, Tin VP, Chung LP, Wong MP, Shay JW, Gazdar AF, Lam WK, Minna JD",Cancer Res,0,7.672,1,,0,0,,,0,,,,,,,,,,,,0,0,0,0,117470787,0,,0,0,0,0,,0,1,1,0,0,0,0,0,0,2007 May 8,5/1/07,"Moore DF, Gelderman MP, Ferreira PA, Fuhrmann SR, Yi H, Elkahloun A, Lix LM, Brady RO, Schiffmann R, Goldin E",Proc Natl Acad Sci U S A,0,9.598,0,,0,0,,,0,,,,,,,,,,,,0,0,0,0,117234736,0,,0,0,0,0,,1,0,0,0,0,0,0,1,1,2007 May 1,5/1/07,"Agrawal S, Hofmann WK, Tidow N, Ehrich M, van den Boom D, Koschmieder S, Berdel WE, Serve H",Blood,3,10.896,1,,0,0,,,0,,,,,,,,,,,,0,0,0,0,117272501,0,,0,0,0,0,,1,1,1,0,0,0,0,1,0,2007 May 15,5/1/07,"Lacoste PP, Soreq L, Le Panse R, Truffault F, Shaked I, Soreq H",Blood,1,10.896,1,,0,0,,,0,,,,,,,,,,,,0,0,0,0,117284533,0,,0,0,0,0,,1,0,0,0,0,0,0,1,1,2007 May 15,5/1/07,"Venturini L, Battmer K, Castoldi M, Schultheis B, Hochhaus A, Muckenthaler MU, Ganser A, Eder M, Scherr M",Blood,9,10.896,1,,0,0,,,0,,,,,,,,,,,,0,0,0,0,117371845,1,1,1,0,1,0,E-MEXP-832,1,1,1,0,0,0,0,1,0,2007 Jun,6/1/07,"van de Sluis B, Muller P, Duran K, Chen A, Groot AJ, Klomp LW, Liu PP, Wijmenga C",Mol Cell Biol,1,6.42,1,E-MEXP-832,1,1,['17371845'],['17371845'],1,,TRUE,['17371845'],17371845,8/25/06,None,Patricia muller,Patricia muller,Mus musculus,24,"A-UMCU-7: UMC Utrecht M. musculus 35K array, version 1.0",1,0,0,0,117513727,1,0,1,0,0,0,http://arrayconsortium.tgen.org,0,1,1,0,0,0,0,1,1,2007 Jun 1,6/1/07,"Carter JH, Lefebvre JM, Wiest DL, Tourtellotte WG",J Immunol,2,6.068,1,,0,1,,,0,,,,,,,,,Mus musculus,,Affymetrix,0,0,0,1,117548813,1,0,1,0,0,0,http://www.pnas.org/content/suppl/2007/05/24/0703490104.DC1,1,0,0,0,0,0,0,1,1,2007 Jun 12,6/1/07,"Albert TK, Grote K, Boeing S, Stelzer G, Schepers A, Meisterernst M",Proc Natl Acad Sci U S A,2,9.598,0,,0,1,,,0,,,,,,,,,Homo sapiens,,Affymetrix,0,0,1,0,117430890,1,1,1,1,0,0,GSE5117,1,1,0,0,0,0,0,1,1,2007 Jun 1,6/1/07,"Kim HS, Kim MS, Hancock AL, Harper JC, Park JY, Poy G, Perantoni AO, Cam M, Malik K, Lee SB",J Biol Chem,3,5.581,1,GSE5117,1,1,[u'17430890'],[u'17430890'],1,,TRUE,['17430890'],17430890,21-Jun-07,21-Jun-06,WeiPing Chen,KIM H,Homo sapiens,4,GPL96: [HG-U133A] Affymetrix Human Genome U133A Array,0,1,0,0,117513749,1,1,1,1,0,0,GSE5134,0,1,1,0,0,0,0,1,0,2007 Jun 1,6/1/07,"Futagami Y, Sugita S, Vega J, Ishida K, Takase H, Maruyama K, Aburatani H, Mochizuki M",J Immunol,0,6.068,1,GSE5134,1,1,[u'17513749'],[u'17513749'],1,,TRUE,['17513749'],17513749,22-Jun-07,23-Jun-06,Yuri Futagami,Futagami Y,Mus musculus,3,GPL1261: [Mouse430_2] Affymetrix Mouse Genome 430 2.0 Array,1,1,0,0,117510629,1,1,1,1,0,0,GSE6557,0,0,0,1,0,0,0,0,0,2007 Jun 20,6/1/07,"Walfridsson J, Khorosjutina O, Matikainen P, Gustafsson CM, Ekwall K",EMBO J,6,8.662,1,GSE6557,1,1,[u'17510629'],[u'17510629'],1,,TRUE,['17510629'],17510629,19-May-07,18-Dec-06,Karl Ekwall,Walfridsson J,Schizosaccharomyces pombe,54,GPL2599: Eurogentec S. pombe IGR+ORF array (K080D),0,1,0,0,117510634,1,1,1,1,0,0,GSE6679,1,0,0,0,0,0,0,1,1,2007 Jun 6,6/1/07,"Kim YK, Furic L, Parisien M, Major F, DesGroseillers L, Maquat LE",EMBO J,4,8.662,1,GSE6679,1,1,[u'17510634'],[u'17510634'],1,,TRUE,['17510634'],17510634,26-Dec-07,8-Jan-07,Luc DesGroseillers,Kim Y,Homo sapiens,6,GPL570: [HG-U133_Plus_2] Affymetrix Human Genome U133 Plus 2.0 Array,1,1,0,0,117420277,1,1,1,1,0,0,GSE6700,0,1,1,0,0,0,0,1,1,2007 Jun,6/1/07,"Klattig J, Sierig R, Kruspe D, Besenbeck B, Englert C",Mol Cell Biol,0,6.42,1,GSE6700,1,1,[u'17420277'],[u'17420277'],1,,TRUE,['17420277'],17420277,1-Jun-07,10-Jan-07,Christoph Englert,Englert C,Mus musculus,6,GPL1524: Amersham CodeLink UniSet Mouse 20K I Bioarray,0,1,0,0,117332242,1,1,1,1,0,0,GSE6728,1,0,0,0,0,0,0,1,1,2007 Jun 15,6/1/07,"Pinyol M, Bea S, Ribrag V, Bosq J, Rosenwald A, Campo E, Jares P",Blood,0,10.896,1,GSE6728,1,1,[u'17332242'],[u'17332242'],1,,TRUE,['17332242'],17332242,31-Dec-07,12-Jan-07,Pedro Jares,Pinyol M,Homo sapiens,15,GPL570: [HG-U133_Plus_2] Affymetrix Human Genome U133 Plus 2.0 Array,1,1,0,0,117468106,1,1,1,1,0,0,GSE6788,0,0,0,0,0,1,0,0,0,2007 Jun 22,6/1/07,"Tian C, Chikayama E, Tsuboi Y, Kuromori T, Shinozaki K, Kikuchi J, Hirayama T",J Biol Chem,2,5.581,1,GSE6788,1,1,[u'17468106'],[u'17468106'],1,,TRUE,['17468106'],17468106,1-May-07,18-Jan-07,Takashi Hirayama,None,Arabidopsis thaliana,4,GPL198: [ATH1-121501] Affymetrix Arabidopsis ATH1 Genome Array,1,1,0,0,117545589,1,1,1,1,0,0,GSE6811,1,0,0,0,0,0,0,0,1,2007 Jun 1,6/1/07,"Tamura K, Furihata M, Tsunoda T, Ashida S, Takata R, Obara W, Yoshioka H, Daigo Y, Nasu Y, Kumon H, Konaka H, Namiki M, Tozawa K, Kohri K, Tanji N, Yokoyama M, Shimazui T, Akaza H, Mizutani Y, Miki T, Fujioka T, Shuin T, Nakamura Y, Nakagawa H",Cancer Res,0,7.672,1,GSE6811,1,1,[u'17545589'],[u'17545589'],1,,TRUE,['17545589'],17545589,1-Jun-07,19-Jan-07,Hidewaki Nakaagwa,Nakagawa H,Homo sapiens,35,GPL4747: YN Human 36K (sets1-8),0,1,0,0,1