pmid,has_online_dataset,pmid_found_in_dbs,ochsner_found_any_data,ochsner_found_geo_data,ochsner_found_arrayexpress_data,ochsner_found_smd_data,ochsner_data_ids,pubmed_is_humans,pubmed_is_animals,pubmed_is_mice,pubmed_is_fungi,pubmed_is_bacteria,pubmed_is_plants,pubmed_is_viruses,pubmed_is_cultured_cells,pubmed_is_cancer,pubmed_date_published,approx_date_published,pubmed_authors,pubmed_journal,pubmed_number_times_cited_in_pmc,impact_factor,discipline_journal,accession,in_centralized_db,data_available,pmids_from_links,pmids_from_links_in_ochsner_set,centralized_link_to_ochsner_pmid,if_no_link_then_what,dataset_in_ochsner,pmid_from_ochsner,pmid_from_links_or_ochsner,release_date,submission_date,submitter,contributors,species,number_samples,array_design,in_arrayexpress,in_geo,ochsner_journal,ochsner_other,journal_policy_requires17003378,1,1,1,0,1,0,E-TABM-24,1,1,1,0,0,0,0,1,1,2007 Jan 15,1/1/07,"Cayrol C, Lacroix C, Mathe C, Ecochard V, Ceribelli M, Loreau E, Lazar V, Dessen P, Mantovani R, Aguilar L, Girard JP",Blood,1,10.896,1,E-TABM-24,1,1,['17003378'],['17003378'],1,,TRUE,['17003378'],17003378,7/28/05,None,Philippe Dessen,Philippe Dessen,Homo sapiens,3,A-AGIL-14: Agilent Human 1A Microarray 011521 G4110A (2004 annotation),1,0,0,0,117099705,1,0,1,0,1,0,E-TABM-143,0,0,0,0,1,0,0,0,0,2007 Jan,1/1/07,"Lynch MD, Warnecke T, Gill RT",Nat Methods,2,15.478,0,E-TABM-143,1,1,,,0,PMID_to_another_paper_same_authors,TRUE,['17099705'],17099705,10/2/06,None,Ryan Gill,Ryan Gill,Escherichia coli,9,A-AFFY-29: Affymetrix GeneChip  E.coli Antisense Genome Array [Ecoli_ASv2],1,0,0,0,117200196,1,0,1,0,0,0,http://ajp.amjpathol.org/cgi/content/full/170/1/227/DC1,1,1,0,0,0,0,0,1,1,2007 Jan,1/1/07,"Eidsmo L, Fluur C, Rethi B, Eriksson Ygberg S, Ruffin N, De Milito A, Akuffo H, Chiodi F",Am J Pathol,0,5.487,1,,0,1,,,0,,,,,,,,,Homo sapiens,,Other,0,0,1,0,017200207,1,0,1,1,0,0,GSE4237,1,0,0,0,0,0,0,1,1,2007 Jan,1/1/07,"Hussaini IM, Trotter C, Zhao Y, Amos S, Xiao A, Agi CU, Redpath GT, Fang Z, Leung GK, Lopes MB, Laws ER Jr",Am J Pathol,0,5.487,1,GSE4237,1,1,,,0,no_citation,TRUE,['17200207'],17200207,14-Feb-06,14-Feb-06,Elizabeth  Salomon,Hussaini IM,Homo sapiens,10,GPL570: [HG-U133_Plus_2] Affymetrix Human Genome U133 Plus 2.0 Array,0,1,0,0,017210724,1,1,1,1,0,0,GSE5222,1,0,0,0,0,0,0,0,1,2007 Jan 1,1/1/07,"Gratias S, Rieder H, Ullmann R, Schneider S, Kappler M, Lohmann DR",Cancer Res,1,7.672,1,GSE5222,1,1,[u'17210724'],[u'17210724'],1,,TRUE,['17210724'],17210724,29-Jan-07,3-Jul-06,Ludger Klein-Hitpass,Gratias S,Homo sapiens,12,GPL96: [HG-U133A] Affymetrix Human Genome U133A Array,1,1,0,0,116960149,1,1,0,0,0,0,,1,0,0,0,0,0,0,1,1,2007 Jan 1,1/1/07,"Richter JA, Siebert R, Climent J, Fresquet V, Beltran E, Agirre X, Marugan I, Rosenwald A, Sugimoto KJ, Wheat LM, Karran EL, Sanchez L, Prosper F, Staudt LM, Pinkel D, Dyer MJ",Blood,3,10.896,1,GSE5316,1,1,[u'16960149'],[u'16960149'],1,,FALSE,,16960149,5-Feb-07,14-Jul-06,Jose Angel Martinez Climent,None,Homo sapiens,48,GPL3789: UCSF HUMAN 1.14,0,1,0,0,117210724,1,1,1,1,0,0,GSE5222,1,0,0,0,0,0,0,0,1,2007 Jan 1,1/1/07,"Gratias S, Rieder H, Ullmann R, Schneider S, Kappler M, Lohmann DR",Cancer Res,1,7.672,1,GSE5359,1,1,[u'17210724'],[u'17210724'],1,,FALSE,,17210724,20-Dec-06,20-Jul-06,Reinhard Ullmann,Gratias S,Homo sapiens,2,GPL3960: MPIMG Homo sapiens 44K aCGH3_MPIMG_BERLIN,1,1,0,0,117234781,1,0,1,1,0,0,GSE5665,1,0,0,0,0,0,0,1,1,2007 Jan 15,1/1/07,"Bhati R, Sledge GW Jr, Fan C, Nakshatri H, Ketelsen D, Borchers CH, Dial MJ, Patterson C",Cancer Res,0,7.672,1,GSE5665,1,1,,,0,no_citation,TRUE,['17234781'],17234781,8-Sep-06,29-Aug-06,Nancy DeMore,None,Homo sapiens,10,GPL887: Agilent-012097 Human 1A Microarray (V2) G4110B (Feature Number version),0,1,0,0,117128275,1,1,1,1,0,0,GSE5974,0,0,0,0,0,1,0,0,0,2007 Jan,1/1/07,"Zilberman D, Gehring M, Tran RK, Ballinger T, Henikoff S",Nat Genet,41,25.556,1,GSE5974,1,1,[u'17128275'],[u'17128275'],1,,TRUE,['17128275'],17128275,26-Nov-06,5-Oct-06,Jorja Henikoff,Zilberman D,Arabidopsis thaliana,5,GPL3371: FHCRC Arabidopsis Tiling Array,0,1,0,0,117060456,1,1,1,1,0,0,GSE6263,1,0,0,0,0,0,0,1,1,2007 Jan,1/1/07,"Kim JS, Lee C, Bonifant CL, Ressom H, Waldman T",Mol Cell Biol,3,6.42,1,GSE6263,1,1,[u'17060456'],[u'17060456'],1,,TRUE,['17060456'],17060456,15-Nov-06,10-Nov-06,JUNGSIK KIM,None,Homo sapiens,5,GPL96: [HG-U133A] Affymetrix Human Genome U133A Array,1,1,0,0,117210755,0,,0,0,0,0,,0,1,1,0,0,0,0,1,0,2007 Jan,1/1/07,"Greenman IC, Gomez E, Moore CE, Herbert TP",J Endocrinol,1,2.636,1,,0,0,,,0,,,,,,,,,,,,0,0,0,0,017023530,0,,0,0,0,0,,0,1,1,0,0,0,0,1,0,2007 Jan,1/1/07,"Seenundun S, Robaire B",Endocrinology,0,5.045,1,,0,0,,,0,,,,,,,,,,,,0,0,0,0,016973760,0,,0,0,0,0,,1,1,1,0,0,0,0,0,0,2007 Jan,1/1/07,"Nilsson M, Stulnig TM, Lin CY, Yeo AL, Nowotny P, Liu ET, Steffensen KR",Mol Endocrinol,0,5.337,1,,0,0,,,0,,,,,,,,,,,,0,0,0,0,017008382,0,,0,0,0,0,,1,1,0,0,0,0,0,0,0,2007 Jan,1/1/07,"Vidal OM, Merino R, Chia DJ, Woelfle J, Ono M, Lenhard B, Norstedt G, Rotwein P",Mol Endocrinol,1,5.337,1,,0,0,,,0,,,,,,,,,,,,0,0,0,0,017105730,0,,0,0,0,0,,1,1,1,0,0,0,0,0,0,2007 Jan 19,1/1/07,"Meadows NA, Sharma SM, Faulkner GJ, Ostrowski MC, Hume DA, Cassady AI",J Biol Chem,0,5.581,1,,0,0,,,0,,,,,,,,,,,,0,0,0,0,117121842,0,,0,0,0,0,,0,0,0,1,0,0,0,0,0,2007 Jan 26,1/1/07,"Wu CY, Bird AJ, Winge DR, Eide DJ",J Biol Chem,3,5.581,1,,0,0,,,0,,,,,,,,,,,,0,0,0,0,117182561,0,,0,0,0,0,,0,1,1,0,0,0,0,0,1,2007 Jan 1,1/1/07,"Gong D, Malek TR",J Immunol,2,6.068,1,,0,0,,,0,,,,,,,,,,,,0,0,0,0,117182576,0,,0,0,0,0,,0,1,1,0,0,0,0,0,0,2007 Jan 1,1/1/07,"Shahlaee AH, Brandal S, Lee YN, Jie C, Takemoto CM",J Immunol,2,6.068,1,,0,0,,,0,,,,,,,,,,,,0,0,0,0,117116744,0,,0,0,0,0,,1,1,0,0,0,0,0,0,1,2007 Jan,1/1/07,"Sacheck JM, Hyatt JP, Raffaello A, Jagoe RT, Roy RR, Edgerton VR, Lecker SH, Goldberg AL",FASEB J,8,6.791,0,,0,0,,,0,,,,,,,,,,,,0,0,0,0,017210681,0,,0,0,0,0,,1,0,0,0,0,0,0,1,1,2007 Jan 1,1/1/07,"Whiteford CC, Bilke S, Greer BT, Chen Q, Braunschweig TA, Cenacchi N, Wei JS, Smith MA, Houghton P, Morton C, Reynolds CP, Lock R, Gorlick R, Khanna C, Thiele CJ, Takikita M, Catchpoole D, Hewitt SM, Khan J",Cancer Res,0,7.672,1,,0,0,,,0,,,,,,,,,,,,0,0,0,0,117210682,0,,0,0,0,0,,1,0,0,0,0,0,0,0,1,2007 Jan 1,1/1/07,"Grade M, Becker S, Hummon AB, Wangsa D, Varma S, Simon R, Liersch T, Becker H, Difilippantonio MJ, Ghadimi BM, Ried T",Cancer Res,2,7.672,1,,0,0,,,0,,,,,,,,,,,,0,0,0,0,117210685,0,,0,0,0,0,,1,1,1,0,0,0,0,1,1,2007 Jan 1,1/1/07,"Lock L, Letamendia A, Gorska AE, Gryfe R, Gallinger S, Moses HL, Attisano L",Cancer Res,3,7.672,1,,0,0,,,0,,,,,,,,,,,,0,0,0,0,117210693,0,,0,0,0,0,,1,1,1,0,0,0,0,1,1,2007 Jan 1,1/1/07,"Nakamura T, Fidler IJ, Coombes KR",Cancer Res,2,7.672,1,,0,0,,,0,,,,,,,,,,,,0,0,0,0,117234769,0,,0,0,0,0,,1,0,0,0,0,0,0,0,1,2007 Jan 15,1/1/07,"West AN, Neale GA, Pounds S, Figueredo BC, Rodriguez Galindo C, Pianovski MA, Oliveira Filho AG, Malkin D, Lalli E, Ribeiro R, Zambetti GP",Cancer Res,0,7.672,1,,0,0,,,0,,,,,,,,,,,,0,0,0,0,117234778,0,,0,0,0,0,,1,1,1,0,0,0,0,1,1,2007 Jan 15,1/1/07,"Cho SD, Yoon K, Chintharlapalli S, Abdelrahim M, Lei P, Hamilton S, Khan S, Ramaiah SK, Safe S",Cancer Res,1,7.672,1,,0,0,,,0,,,,,,,,,,,,0,0,0,0,117227853,0,,0,0,0,0,,0,1,0,1,0,0,0,0,0,2007 Jan 23,1/1/07,"Tan K, Shlomi T, Feizi H, Ideker T, Sharan R",Proc Natl Acad Sci U S A,4,9.598,0,,0,0,,,0,,,,,,,,,,,,0,0,0,0,117227867,0,,0,0,0,0,,1,1,1,0,0,0,0,0,1,2007 Jan 23,1/1/07,"Ahmad S, Tang W, Chang Q, Qu Y, Hibshman J, Li Y, Willecke K, Chen P, Lin X",Proc Natl Acad Sci U S A,2,9.598,0,,0,0,,,0,,,,,,,,,,,,0,0,0,0,117237218,0,,0,0,0,0,,0,0,0,0,0,1,0,0,0,2007 Jan 30,1/1/07,"Keurentjes JJ, Fu J, Terpstra IR, Garcia JM, van den Ackerveken G, Snoek LB, Peeters AJ, Vreugdenhil D, Koornneef M, Jansen RC",Proc Natl Acad Sci U S A,20,9.598,0,,0,0,,,0,,,,,,,,,,,,0,0,0,0,117242365,0,,0,0,0,0,,0,1,1,0,0,0,0,0,1,2007 Jan 30,1/1/07,"Taganov KD, Boldin MP, Cheng G, Baltimore D",Proc Natl Acad Sci U S A,22,9.598,0,,0,0,,,0,,,,,,,,,,,,0,0,0,0,117115035,0,,0,0,0,0,,1,0,0,0,0,0,0,1,0,2007 Jan,1/1/07,"Hansen A, Chen Y, Inman JM, Phan QN, Qi ZQ, Xiang CC, Palkovits M, Cherman N, Kuznetsov SA, Robey PG, Mezey E, Brownstein MJ",Nat Methods,0,15.478,0,,0,0,,,0,,,,,,,,,,,,0,0,0,0,117283147,1,0,1,0,1,0,E-MIMR-11,1,0,0,0,0,0,0,0,1,2007 Feb 1,2/1/07,"Arance A, Kubitza L, Jat P, Ogilvie CM, Hart IR, Higgins CF, Raguz S",Cancer Res,0,7.672,1,E-MIMR-11,1,1,,,0,?Citation to other papers,TRUE,['17283147'],17283147,9/7/05,None,Ernesto Yague,Ernesto Yague,Homo sapiens,1,A-AFFY-34: Affymetrix GeneChip  Human Genome HG-U133B [HG-U133B],1,0,0,0,117307872,1,0,1,0,1,0,E-MEXP-936,0,0,0,0,0,0,0,0,0,2007 Feb 20,2/1/07,"Lundgren M, Bernander R",Proc Natl Acad Sci U S A,8,9.598,0,E-MEXP-936,1,1,,,0,no_citation,TRUE,['17307872'],17307872,12/7/07,None,Magnus Lundgren,Magnus Lundgren,Sulfolobus acidocaldarius,24,A-MEXP-610: KTH Sulfolobus v10,1,0,0,0,117101797,1,0,1,0,0,0,http://mcb.asm.org/cgi/content/full/27/4/1348/DC1,1,0,0,0,0,0,0,1,1,2007 Feb,2/1/07,"Ishida M, Miyamoto M, Naitoh S, Tatsuda D, Hasegawa T, Nemoto T, Yokozeki H, Nishioka K, Matsukage A, Ohki M, Ohta T",Mol Cell Biol,0,6.42,1,,0,1,,,0,,,,,,,,,Homo sapiens,,Affymetrix,0,0,1,0,117308088,1,0,1,0,0,0,UNC-MD-Experiment-Set-No_1741,1,0,0,0,0,0,0,1,1,2007 Feb 15,2/1/07,"Shields JM, Thomas NE, Cregger M, Berger AJ, Leslie M, Torrice C, Hao H, Penland S, Arbiser J, Scott G, Zhou T, Bear JE, Der CJ, Kaufmann WK, Rimm DL, Sharpless NE",Cancer Res,5,7.672,1,,0,1,,,0,,,,,,,,,Homo sapiens,,Other,0,0,0,1,117360660,1,0,1,0,0,0,www3.mdanderson.org/~genomics/sarcoma_data_matrix_for_supplemental.zip,1,0,0,0,0,0,0,0,1,2007 Feb 27,2/1/07,"Price ND, Trent J, Cogdell D, Taylor E, Hunt KK, Pollock RE, Hood L, Shmulevich I, Zhang W",Proc Natl Acad Sci U S A,7,9.598,0,,0,1,,,0,,,,,,,,,Homo sapiens,,Other,0,0,0,1,117023574,1,1,1,1,0,0,"GSE2658,GSE5900",1,0,0,0,0,0,0,0,1,2007 Feb 15,2/1/07,"Zhan F, Barlogie B, Arzoumanian V, Huang Y, Williams DR, Hollmig K, Tricot G, van Rhee F, Zangari M, Dhodapkar M, Shaughnessy JD Jr",Blood,6,10.896,1,GSE2658,1,1,"[u'16688228', u'16728703', u'17023574']",[u'17023574'],1,,TRUE,['17023574'],17023574,1-Jun-06,13-May-05,Shaughnessy Jr. John,Shaughnessy JD,Homo sapiens,559,GPL570: [HG-U133_Plus_2] Affymetrix Human Genome U133 Plus 2.0 Array,1,1,0,0,117308126,1,1,1,1,0,0,GSE2774,0,1,1,0,0,0,1,0,1,2007 Feb 15,2/1/07,"Lin KY, Lu D, Hung CF, Peng S, Huang L, Jie C, Murillo F, Rowley J, Tsai YC, He L, Kim DJ, Jaffee E, Pardoll D, Wu TC",Cancer Res,0,7.672,1,GSE2774,1,1,[u'17308126'],[u'17308126'],1,,TRUE,['17308126'],17308126,6-Dec-05,6-Jun-05,Ken-Yu Lin,Lin K,Mus musculus,8,GPL1261: [Mouse430_2] Affymetrix Mouse Genome 430 2.0 Array,1,1,0,0,117360665,1,1,1,1,0,0,"GSE3849,GSE3850",0,1,1,0,0,0,0,0,0,2007 Feb 27,2/1/07,"Curtis AM, Cheng Y, Kapoor S, Reilly D, Price TS, Fitzgerald GA",Proc Natl Acad Sci U S A,3,9.598,0,GSE3849,1,1,[u'17360665'],[u'17360665'],1,,TRUE,['17360665'],17360665,16-Dec-06,16-Dec-05,Radu Daniel Rudic,Curtis AM,Mus musculus,10,GPL1261: [Mouse430_2] Affymetrix Mouse Genome 430 2.0 Array,1,1,0,0,117360665,1,1,1,1,0,0,"GSE3849,GSE3850",0,1,1,0,0,0,0,0,0,2007 Feb 27,2/1/07,"Curtis AM, Cheng Y, Kapoor S, Reilly D, Price TS, Fitzgerald GA",Proc Natl Acad Sci U S A,3,9.598,0,GSE3850,1,1,[u'17360665'],[u'17360665'],1,,TRUE,['17360665'],17360665,16-Dec-06,16-Dec-05,Radu Daniel Rudic,Curtis AM,Mus musculus,9,GPL1261: [Mouse430_2] Affymetrix Mouse Genome 430 2.0 Array,1,1,0,0,117023574,1,1,1,1,0,0,"GSE2658,GSE5900",1,0,0,0,0,0,0,0,1,2007 Feb 15,2/1/07,"Zhan F, Barlogie B, Arzoumanian V, Huang Y, Williams DR, Hollmig K, Tricot G, van Rhee F, Zangari M, Dhodapkar M, Shaughnessy JD Jr",Blood,6,10.896,1,GSE5900,1,1,[u'17023574'],[u'17023574'],1,,TRUE,['17023574'],17023574,6-Oct-06,21-Sep-06,Shaughnessy Jr. John,Shaughnessy JD,Homo sapiens,78,GPL570: [HG-U133_Plus_2] Affymetrix Human Genome U133 Plus 2.0 Array,1,1,0,0,117296934,1,1,1,1,0,0,GSE6004,1,0,0,0,0,0,0,1,1,2007 Feb 20,2/1/07,"Vasko V, Espinosa AV, Scouten W, He H, Auer H, Liyanarachchi S, Larin A, Savchenko V, Francis GL, de la Chapelle A, Saji M, Ringel MD",Proc Natl Acad Sci U S A,2,9.598,0,GSE6004,1,1,[u'17296934'],[u'17296934'],1,,TRUE,['17296934'],17296934,11-Oct-06,10-Oct-06,Sandya Liyanarachchi,Vasko V,Homo sapiens,18,GPL570: [HG-U133_Plus_2] Affymetrix Human Genome U133 Plus 2.0 Array,1,1,0,0,117166848,1,1,1,1,0,0,GSE6136,1,1,1,0,0,0,0,0,1,2007 Feb 16,2/1/07,"Lenburg ME, Sinha A, Faller DV, Denis GV",J Biol Chem,1,5.581,1,GSE6136,1,1,[u'17166848'],[u'17166848'],1,,TRUE,['17166848'],17166848,28-Oct-06,25-Oct-06,Marc E. Lenburg,Lenburg ME,Mus musculus,26,GPL8321: [Mouse430A_2] Affymetrix Mouse Genome 430A 2.0 Array,1,1,0,0,117110430,0,,0,0,0,0,,1,1,0,0,0,0,0,0,1,2007 Feb,2/1/07,"Sherwin JR, Sharkey AM, Cameo P, Mavrogianis PM, Catalano RD, Edassery S, Fazleabas AT",Endocrinology,0,5.045,1,,0,0,,,0,,,,,,,,,,,,0,0,0,0,017122083,0,,0,0,0,0,,1,1,1,0,0,0,0,1,0,2007 Feb,2/1/07,"Adamo ML, Marmolejos V, Churchill GA, Shockley KR, Reid IR, Grey A, Rosen CJ",Endocrinology,4,5.045,1,,0,0,,,0,,,,,,,,,,,,0,0,0,0,017068196,0,,0,0,0,0,,0,1,1,0,0,0,0,1,1,2007 Feb,2/1/07,"Clines GA, Mohammad KS, Bao Y, Stephens OW, Suva LJ, Shaughnessy JD Jr, Fox JW, Chirgwin JM, Guise TA",Mol Endocrinol,0,5.337,1,,0,0,,,0,,,,,,,,,,,,0,0,0,0,017255321,0,,0,0,0,0,,0,1,1,0,1,0,0,0,1,2007 Feb,2/1/07,"Roche JK, Keepers TR, Gross LK, Seaner RM, Obrig TG",Am J Pathol,0,5.487,1,,0,0,,,0,,,,,,,,,,,,0,0,0,0,017095510,0,,0,0,0,0,,1,0,0,0,0,0,0,1,1,2007 Feb 9,2/1/07,"Stojadinovic O, Lee B, Vouthounis C, Vukelic S, Pastar I, Blumenberg M, Brem H",J Biol Chem,3,5.581,1,,0,0,,,0,,,,,,,,,,,,0,0,0,0,117135251,0,,0,0,0,0,,0,1,1,0,0,0,0,0,1,2007 Feb 2,2/1/07,"Pyott SJ, Meredith AL, Fodor AA, Yamoah EN, Aldrich RW",J Biol Chem,2,5.581,1,,0,0,,,0,,,,,,,,,,,,0,0,0,0,117237411,0,,0,0,0,0,,0,1,1,0,0,0,0,0,0,2007 Feb 1,2/1/07,"Jordan MA, Fletcher JM, Pellicci D, Baxter AG",J Immunol,1,6.068,1,,0,0,,,0,,,,,,,,,,,,0,0,0,0,117237439,0,,0,0,0,0,,0,1,1,0,0,0,0,0,1,2007 Feb 1,2/1/07,"Beaty SR, Rose CE Jr, Sung SS",J Immunol,4,6.068,1,,0,0,,,0,,,,,,,,,,,,0,0,0,0,117277136,0,,0,0,0,0,,1,0,0,0,0,0,0,1,1,2007 Feb 15,2/1/07,"Oved K, Ziv O, Noy R, Novak H, Makler O, Galit D, Keren S, Segal D, Amariglio N, Rechavi G, Reiter Y",J Immunol,1,6.068,1,,0,0,,,0,,,,,,,,,,,,0,0,0,0,117101774,0,,0,0,0,0,,0,0,0,1,0,0,0,0,0,2007 Feb,2/1/07,"Abruzzi K, Denome S, Olsen JR, Assenholt J, Haaning LL, Jensen TH, Rosbash M",Mol Cell Biol,2,6.42,1,,0,0,,,0,,,,,,,,,,,,0,0,0,0,117101777,0,,0,0,0,0,,0,0,0,1,0,0,0,0,0,2007 Feb,2/1/07,"Lahav R, Gammie A, Tavazoie S, Rose MD",Mol Cell Biol,3,6.42,1,,0,0,,,0,,,,,,,,,,,,0,0,0,0,117308118,0,,0,0,0,0,,1,0,0,0,0,0,0,0,1,2007 Feb 15,2/1/07,"Lu C, Bonome T, Li Y, Kamat AA, Han LY, Schmandt R, Coleman RL, Gershenson DM, Jaffe RB, Birrer MJ, Sood AK",Cancer Res,1,7.672,1,,0,0,,,0,,,,,,,,,,,,0,0,0,0,117360662,0,,0,0,0,0,,0,1,1,0,0,0,0,1,0,2007 Feb 27,2/1/07,"Kato M, Zhang J, Wang M, Lanting L, Yuan H, Rossi JJ, Natarajan R",Proc Natl Acad Sci U S A,7,9.598,0,,0,0,,,0,,,,,,,,,,,,0,0,0,0,117018853,0,,0,0,0,0,,0,1,1,0,0,0,0,0,1,2007 Feb 1,2/1/07,"Longman RS, Braun D, Pellegrini S, Rice CM, Darnell RB, Albert ML",Blood,3,10.896,1,,0,0,,,0,,,,,,,,,,,,0,0,0,0,117018861,0,,0,0,0,0,,1,0,0,0,0,0,0,0,0,2007 Feb 1,2/1/07,"Ehrchen J, Barczyk K, Tenbrock K, Nacken W, Eisenacher M, Nordhues U, Sorg C, Roth J",Blood,1,10.896,1,,0,0,,,0,,,,,,,,,,,,0,0,0,0,117360330,1,1,1,0,1,0,E-TABM-231,1,0,0,0,0,0,0,1,1,2007 Mar 20,3/1/07,"Kwon YS, Hutt KR, Cheng CS, Jin M, Liu D, Benner C, Wang D, Ye Z, Bibikova M, Fan JB, Duan L, Glass CK, Rosenfeld MG, Fu XD",Proc Natl Acad Sci U S A,12,9.598,0,E-MEXP-984,1,1,['17360330'],['17360330'],1,,FALSE,,17360330,3/1/07,None,Kasey Hutt,Kasey Hutt,Homo sapiens,12,A-MEXP-651: Fu H. sapiens Human Promoter DSL 20k v1,1,0,0,0,117360330,1,1,1,0,1,0,E-TABM-231,1,0,0,0,0,0,0,1,1,2007 Mar 20,3/1/07,"Kwon YS, Hutt KR, Cheng CS, Jin M, Liu D, Benner C, Wang D, Ye Z, Bibikova M, Fan JB, Duan L, Glass CK, Rosenfeld MG, Fu XD",Proc Natl Acad Sci U S A,12,9.598,0,E-TABM-231,1,1,['17360330'],['17360330'],1,,TRUE,['17360330'],17360330,3/1/07,None,Kasey Hutt,Kasey Hutt,Homo sapiens,8,A-MEXP-525: Illumina HumanRef-8 v1 Expression BeadChip,1,0,0,0,117372200,1,1,1,0,1,0,E-MEXP-854,1,0,0,0,0,0,0,1,0,2007 Mar 27,3/1/07,"Lindecke A, Hatzmann W, Kaltschmidt C, Dittmar T",Proc Natl Acad Sci U S A,0,9.598,0,E-MEXP-854,1,1,['17372200'],['17372200'],1,,TRUE,['17372200'],17372200,1/22/07,None,Thomas Dittmar,Thomas Dittmar,Homo sapiens,20,A-MEXP-221: uwh_cDNA_human,1,0,0,0,117077326,1,1,0,0,0,0,,1,0,0,0,0,0,0,1,1,2007 Mar 1,3/1/07,"Lamant L, Duplantier MM, Rickman DS, Sabourdy F, Giuriato S, Gaulard P, Espinos E, Delsol G",Blood,5,10.896,1,E-TABM-117,1,1,['17077326'],['17077326'],1,,FALSE,,17077326,7/9/06,None,Fabien Petel,Fabien Petel,Homo sapiens,37,A-AFFY-33: Affymetrix GeneChip  Human Genome HG-U133A [HG-U133A],1,0,0,0,117182623,1,0,1,0,1,0,E-MEXP-560,1,0,0,0,0,0,0,0,0,2007 Mar 9,3/1/07,"Abdallah BM, Boissy P, Tan Q, Dahlgaard J, Traustadottir GA, Kupisiewicz K, Laborda J, Delaisse JM, Kassem M",J Biol Chem,0,5.581,1,E-MEXP-560,1,1,,,0,no_citation,TRUE,['17182623'],17182623,2/15/06,None,Basem Abdallah,Basem Abdallah,Homo sapiens,6,A-AFFY-37: Affymetrix GeneChip  Human Genome U133A 2.0 [HG-U133A_2],1,0,0,0,117158205,1,0,1,0,0,0,https://caarraydb.nci.nih.gov/caarray/publicExperimentDetailAction.do?expId=1015897590892008,0,1,1,0,0,0,0,1,1,2007 Mar,3/1/07,"Huh JI, Qiu TH, Chandramouli GV, Charles R, Wiench M, Hager GL, Catena R, Calvo A, LaVallee TM, Desprez PY, Green JE",Endocrinology,1,5.045,1,,0,1,,,0,,,,,,,,,Mus musculus,,Affymetrix,0,0,0,1,017194750,1,0,1,0,0,0,http://mcb.asm.org/cgi/content/full/27/5/1859/DC1,1,0,0,0,0,0,0,1,1,2007 Mar,3/1/07,"Kulshreshtha R, Ferracin M, Wojcik SE, Garzon R, Alder H, Davuluri R, Liu CG, Croce CM, Negrini M, Calin GA, Ivan M",Mol Cell Biol,8,6.42,1,,0,1,,,0,,,,,,,,,Homo sapiens,,Other,0,0,1,0,117105813,1,0,1,1,0,0,GSE2658,1,0,0,0,0,0,0,0,1,2007 Mar 15,3/1/07,"Shaughnessy JD Jr, Zhan F, Burington BE, Huang Y, Colla S, Hanamura I, Stewart JP, Kordsmeier B, Randolph C, Williams DR, Xiao Y, Xu H, Epstein J, Anaissie E, Krishna SG, Hollmig K, Mohiuddin A, Tricot G, van Rhee F, Sawyer J, Alsayed Y, Walker R, Zangari M, Crowley J, Barlogie B",Blood,7,10.896,1,GSE2658,1,1,"[u'16688228', u'16728703', u'17023574']",[u'17023574'],0,PMID_to_another_paper_same_authors,TRUE,['17023574'],17023574,1-Jun-06,13-May-05,Shaughnessy Jr. John,Shaughnessy JD,Homo sapiens,559,GPL570: [HG-U133_Plus_2] Affymetrix Human Genome U133 Plus 2.0 Array,1,0,0,0,117339462,1,0,1,1,0,0,GSE2770,1,0,0,0,0,0,0,1,1,2007 Mar 15,3/1/07,"Lund RJ, Naumanen T, Dixon C, Chen Z, Ahlfors H, Tuomela S, Tahvanainen J, Scheinin J, Henttinen T, Rasool O, Lahesmaa R",J Immunol,1,6.068,1,GSE2770,1,1,[u'14607935'],,0,PMID_to_prev_paper_by_same_authors,TRUE,['17339462'],17339462,1-Sep-05,6-Jun-05,Riikka Johanna Lund,Lund RJ,Homo sapiens,102,GPL96: [HG-U133A] Affymetrix Human Genome U133A Array,0,1,0,0,117334370,1,1,1,1,0,0,"GSE4115,http://pulm.bumc.bu.edu/CancerDx",1,0,0,0,0,0,0,0,1,2007 Mar,3/1/07,"Spira A, Beane JE, Shah V, Steiling K, Liu G, Schembri F, Gilman S, Dumas YM, Calner P, Sebastiani P, Sridhar S, Beamis J, Lamb C, Anderson T, Gerry N, Keane J, Lenburg ME, Brody JS",Nat Med,4,26.382,1,GSE4115,1,1,[u'17334370'],[u'17334370'],1,,TRUE,['17334370'],17334370,27-Feb-06,29-Jan-06,Avrum Spira,None,Homo sapiens,192,GPL96: [HG-U133A] Affymetrix Human Genome U133A Array,0,1,0,1,117332525,1,1,1,1,0,0,GSE5131,0,1,0,0,0,0,0,0,0,2007 Mar,3/1/07,"Xia W, Mruk DD, Lee WM, Cheng CY",J Endocrinol,0,2.636,1,GSE5131,1,1,[u'17332525'],[u'17332525'],1,,TRUE,['17332525'],17332525,7-Jul-06,22-Jun-06,Weiliang Xia,Xia W,Rattus norvegicus,8,GPL1355: [Rat230_2] Affymetrix Rat Genome 230 2.0 Array,1,1,0,0,017242213,1,1,1,1,0,0,GSE5310,1,1,0,0,0,0,0,1,0,2007 Mar,3/1/07,"Jewell CM, Bienstock RJ, Collins JB, Cidlowski JA",Mol Cell Biol,2,6.42,1,GSE5310,1,1,[u'17242213'],[u'17242213'],1,,TRUE,['17242213'],17242213,2-Mar-07,14-Jul-06,NIEHS Microarray Core,Lewis-Tuffin LJ,Homo sapiens,24,GPL887: Agilent-012097 Human 1A Microarray (V2) G4110B (Feature Number version),1,1,0,0,117205981,1,1,1,1,0,0,GSE5348,1,1,1,0,0,0,0,0,0,2007 Mar 16,3/1/07,"Huster D, Purnat TD, Burkhead JL, Ralle M, Fiehn O, Stuckert F, Olson NE, Teupser D, Lutsenko S",J Biol Chem,1,5.581,1,GSE5348,1,1,[u'17205981'],[u'17205981'],1,,TRUE,['17205981'],17205981,19-Dec-06,19-Jul-06,Svetlana Lutsenko,Lutsenko S,Mus musculus,6,GPL339: [MOE430A] Affymetrix Mouse Expression 430A Array,1,1,0,0,117227774,1,1,1,1,0,0,GSE5767,0,1,0,0,1,0,0,0,1,2007 Mar 23,3/1/07,"Pal S, St Leger RJ, Wu LP",J Biol Chem,2,5.581,1,GSE5767,1,1,[u'17227774'],[u'17227774'],1,,TRUE,['17227774'],17227774,10-Feb-07,5-Sep-06,Subhamoy Pal,None,Drosophila melanogaster,3,GPL4064: UMBI_Drosophila_1440_1,0,1,0,0,117339457,1,0,1,1,0,0,GSE5907,0,1,1,0,0,0,0,1,0,2007 Mar 15,3/1/07,"Cuesta N, Nhu QM, Zudaire E, Polumuri S, Cuttitta F, Vogel SN",J Immunol,0,6.068,1,GSE5907,1,1,,,0,no_citation,TRUE,['17339457'],17339457,1-Sep-07,25-Sep-06,Enrique Zudaire,None,Mus musculus,6,GPL1529: NCI/LMT Mm_FCRF_UniGEM2,0,1,0,0,117105821,1,1,1,1,0,0,GSE6269,1,0,0,0,0,0,0,0,1,2007 Mar 1,3/1/07,"Ramilo O, Allman W, Chung W, Mejias A, Ardura M, Glaser C, Wittkowski KM, Piqueras B, Banchereau J, Palucka AK, Chaussabel D",Blood,11,10.896,1,GSE6269,1,1,[u'17105821'],[u'17105821'],1,,TRUE,['17105821'],17105821,16-Mar-07,13-Nov-06,Damien Chaussabel,None,Homo sapiens,143,GPL96: [HG-U133A] Affymetrix Human Genome U133A Array,1,1,0,0,117242205,1,1,1,1,0,0,GSE6838,1,0,0,0,0,0,0,1,1,2007 Mar,3/1/07,"Linsley PS, Schelter J, Burchard J, Kibukawa M, Martin MM, Bartz SR, Johnson JM, Cummins JM, Raymond CK, Dai H, Chau N, Cleary M, Jackson AL, Carleton M, Lim L",Mol Cell Biol,19,6.42,1,GSE6838,1,1,[u'17242205'],[u'17242205'],1,,TRUE,['17242205'],17242205,1-Feb-07,22-Jan-07,Julja Burchard,Linsley PS,Homo sapiens,71,GPL3991: Human 3.0 A1,0,1,0,0,117360536,1,1,1,1,0,0,GSE7032,0,1,1,0,0,0,0,0,0,2007 Mar 13,3/1/07,"Timmons JA, Wennmalm K, Larsson O, Walden TB, Lassmann T, Petrovic N, Hamilton DL, Gimeno RE, Wahlestedt C, Baar K, Nedergaard J, Cannon B",Proc Natl Acad Sci U S A,8,9.598,0,GSE7032,1,1,[u'17360536'],[u'17360536'],1,,TRUE,['17360536'],17360536,31-May-07,14-Feb-07,Ola Larsson,Larsson O,Mus musculus,24,GPL81: [MG_U74Av2] Affymetrix Murine Genome U74 Version 2 Array,1,1,0,0,117110422,0,,0,0,0,0,,0,1,1,0,0,0,0,1,1,2007 Mar,3/1/07,"Han L, Dias Figueiredo M, Berghorn KA, Iwata TN, Welsh IC, Wang W, Lin DM, Roberson MS",Endocrinology,2,5.045,1,,0,0,,,0,,,,,,,,,,,,0,0,0,0,017138655,0,,0,0,0,0,,0,1,1,0,0,0,0,1,0,2007 Mar,3/1/07,"Demers A, Ong H, Tremblay A",Endocrinology,1,5.045,1,,0,0,,,0,,,,,,,,,,,,0,0,0,0,017170073,0,,0,0,0,0,,0,1,1,0,0,0,0,1,1,2007 Mar,3/1/07,"zur Nieden NI, Price FD, Davis LA, Everitt RE, Rancourt DE",Mol Endocrinol,0,5.337,1,,0,0,,,0,,,,,,,,,,,,0,0,0,0,017209051,0,,0,0,0,0,,1,0,0,0,0,0,0,1,1,2007 Mar 9,3/1/07,"Li Y, Zeng SX, Landais I, Lu H",J Biol Chem,0,5.581,1,,0,0,,,0,,,,,,,,,,,,0,0,0,0,117215245,0,,0,0,0,0,,0,0,0,1,0,0,0,0,0,2007 Mar 9,3/1/07,"Milgrom E, Diab H, Middleton F, Kane PM",J Biol Chem,0,5.581,1,,0,0,,,0,,,,,,,,,,,,0,0,0,0,117312182,0,,0,0,0,0,,1,0,0,0,0,0,0,0,1,2007 Mar 1,3/1/07,"Condomines M, Hose D, Raynaud P, Hundemer M, De Vos J, Baudard M, Moehler T, Pantesco V, Moos M, Schved JF, Rossi JF, Goldschmidt H, Klein B",J Immunol,0,6.068,1,,0,0,,,0,,,,,,,,,,,,0,0,0,0,117178835,0,,0,0,0,0,,0,1,1,0,0,0,1,1,1,2007 Mar,3/1/07,"Jiang SX, Sheldrick M, Desbois A, Slinn J, Hou ST",Mol Cell Biol,0,6.42,1,,0,0,,,0,,,,,,,,,,,,0,0,0,0,117332365,0,,0,0,0,0,,1,1,1,0,0,0,0,1,1,2007 Mar 1,3/1/07,"Zeng Y, Huebener N, Fest S, Weixler S, Schroeder U, Gaedicke G, Xiang R, Schramm A, Eggert A, Reisfeld RA, Lode HN",Cancer Res,0,7.672,1,,0,0,,,0,,,,,,,,,,,,0,0,0,0,117363560,0,,0,0,0,0,,1,1,1,0,0,0,0,0,1,2007 Mar 15,3/1/07,"Matthews CP, Birkholz AM, Baker AR, Perella CM, Beck GR Jr, Young MR, Colburn NH",Cancer Res,1,7.672,1,,0,0,,,0,,,,,,,,,,,,0,0,0,0,117363561,0,,0,0,0,0,,1,1,1,0,0,0,0,0,1,2007 Mar 15,3/1/07,"Qi CF, Zhou JX, Lee CH, Naghashfar Z, Xiang S, Kovalchuk AL, Fredrickson TN, Hartley JW, Roopenian DC, Davidson WF, Janz S, Morse HC 3rd",Cancer Res,0,7.672,1,,0,0,,,0,,,,,,,,,,,,0,0,0,0,117372210,0,,0,0,0,0,,1,1,1,0,0,0,0,0,1,2007 Mar 27,3/1/07,"Chen CD, Shi T, Horvath S, Nelson SF, Reichardt JK, Sawyers CL",Proc Natl Acad Sci U S A,6,9.598,0,,0,0,,,0,,,,,,,,,,,,0,0,0,0,117372224,0,,0,0,0,0,,0,0,0,0,1,0,0,0,0,2007 Mar 27,3/1/07,"Wang JD, Berkmen MB, Grossman AD",Proc Natl Acad Sci U S A,2,9.598,0,,0,0,,,0,,,,,,,,,,,,0,0,0,0,117068156,0,,0,0,0,0,,1,0,0,0,0,0,1,1,1,2007 Mar 1,3/1/07,"Fakruddin JM, Lempicki RA, Gorelick RJ, Yang J, Adelsberger JW, Pinto LA, Lane HC, Imamichi T",Blood,0,10.896,1,,0,0,,,0,,,,,,,,,,,,0,0,0,0,117095626,0,,0,0,0,0,,1,0,0,0,0,0,0,1,1,2007 Mar 15,3/1/07,"Diakos C, Krapf G, Gerner C, Inthal A, Lemberger C, Ban J, Dohnal AM",Blood,1,10.896,1,,0,0,,,0,,,,,,,,,,,,0,0,0,0,117371987,1,1,1,0,1,0,E-MEXP-763,1,0,0,0,0,0,0,1,0,2007 Apr 1,4/1/07,"Vermijlen D, Ellis P, Langford C, Klein A, Engel R, Willimann K, Jomaa H, Hayday AC, Eberl M",J Immunol,2,6.068,1,E-MEXP-763,1,1,['17371987'],['17371987'],1,,TRUE,['17371987'],17371987,7/4/06,None,David Vermijlen,David Vermijlen,Homo sapiens,3,"A-MEXP-210: Sanger Institute H. sapiens 15K array, Hver2.1.1",1,0,0,0,117371987,1,1,1,0,1,0,E-MEXP-763,1,0,0,0,0,0,0,1,0,2007 Apr 1,4/1/07,"Vermijlen D, Ellis P, Langford C, Klein A, Engel R, Willimann K, Jomaa H, Hayday AC, Eberl M",J Immunol,2,6.068,1,E-MEXP-764,1,1,['17371987'],['17371987'],1,,FALSE,,17371987,8/17/06,None,Chun Shi,Chun Shi,Zea mays,8,A-MEXP-87: IOWA Schnable lab-maize-11439,1,0,0,0,1